{
  "GET /api/currentUser": {
    "res": {
      "data": {
        "name": "Serati Ma",
        "avatar": "https://gw.alipayobjects.com/zos/rmsportal/BiazfanxmamNRoxxVxka.png",
        "userid": "00000001",
        "email": "antdesign@alipay.com",
        "signature": "海纳百川，有容乃大",
        "title": "交互专家",
        "group": "蚂蚁金服－某某某事业群－某某平台部－某某技术部－UED",
        "tags": [
          {
            "key": "0",
            "label": "很有想法的"
          },
          {
            "key": "1",
            "label": "专注设计"
          },
          {
            "key": "2",
            "label": "辣~"
          },
          {
            "key": "3",
            "label": "大长腿"
          },
          {
            "key": "4",
            "label": "川妹子"
          },
          {
            "key": "5",
            "label": "海纳百川"
          }
        ],
        "notifyCount": 12,
        "unreadCount": 11,
        "country": "China",
        "geographic": {
          "province": {
            "label": "浙江省",
            "key": "330000"
          },
          "city": {
            "label": "杭州市",
            "key": "330100"
          }
        },
        "address": "西湖区工专路 77 号",
        "phone": "0752-268888888"
      }
    },
    "query": {},
    "payload": {},
    "types": "/** GET /api/currentUser */\nexport type GET_API_CURRENT_USER_QUERY = {\n  \n}\n  \n\nexport type GET_API_CURRENT_USER_PAYLOAD = {\n  \n}\n  \n\nexport type GET_API_CURRENT_USER_RES = {\n  /** example: {\"name\": \"Serati Ma\", \"avatar\": \"https: //gw.alipayobjects.com/zos/rmsportal/BiazfanxmamNRoxxVxka.png\", \"userid\": \"00000001\", \"email\": \"antdesign@alipay.com\", \"signature\": \"海纳百川，有容乃大\", \"title\": \"交互专家\", \"group\": \"蚂蚁金服－某某某事业群－某某平台部－某某技术部－UED\", \"tags\": [{\"key\": \"0\", \"label\": \"很有想法的\"}, {\"key\": \"1\", \"label\": \"专注设计\"}, {\"key\": \"2\", \"label\": \"辣~\"}, {\"key\": \"3\", \"label\": \"大长腿\"}, {\"key\": \"4\", \"label\": \"川妹子\"}, {\"key\": \"5\", \"label\": \"海纳百川\"}], \"notifyCount\": 12, \"unreadCount\": 11, \"country\": \"China\", \"geographic\": {\"province\": {\"label\": \"浙江省\", \"key\": \"330000\"}, \"city\": {\"label\": \"杭州市\", \"key\": \"330100\"}}, \"address\": \"西湖区工专路 77 号\", \"phone\": \"0752-268888888\"} */\n        data: {\n      name: string,\navatar: string,\nuserid: string,\nemail: string,\nsignature: string,\ntitle: string,\ngroup: string,\ntags: {\n      key: string,\nlabel: string\n      }[],\nnotifyCount: number,\nunreadCount: number,\ncountry: string,\ngeographic: {\n      province: {\n      label: string,\nkey: string\n      },\ncity: {\n      label: string,\nkey: string\n      }\n      },\naddress: string,\nphone: string\n      }\n}\n  "
  },
  "GET /api/rule": {
    "res": {
      "data": [
        {
          "key": 99,
          "disabled": false,
          "href": "https://ant.design",
          "avatar": "https://gw.alipayobjects.com/zos/rmsportal/udxAbMEhpwthVVcjLXik.png",
          "name": "TradeCode 99",
          "owner": "曲丽丽",
          "desc": "这是一段描述",
          "callNo": 118,
          "status": "3",
          "updatedAt": "2023-05-06T06:00:33.361Z",
          "createdAt": "2023-05-06T06:00:33.361Z",
          "progress": 44
        },
        {
          "key": 98,
          "disabled": false,
          "href": "https://ant.design",
          "avatar": "https://gw.alipayobjects.com/zos/rmsportal/eeHMaZBwmTvLdIwMfBpg.png",
          "name": "TradeCode 98",
          "owner": "曲丽丽",
          "desc": "这是一段描述",
          "callNo": 267,
          "status": "0",
          "updatedAt": "2023-05-06T06:00:33.361Z",
          "createdAt": "2023-05-06T06:00:33.361Z",
          "progress": 46
        },
        {
          "key": 97,
          "disabled": false,
          "href": "https://ant.design",
          "avatar": "https://gw.alipayobjects.com/zos/rmsportal/udxAbMEhpwthVVcjLXik.png",
          "name": "TradeCode 97",
          "owner": "曲丽丽",
          "desc": "这是一段描述",
          "callNo": 642,
          "status": "3",
          "updatedAt": "2023-05-06T06:00:33.361Z",
          "createdAt": "2023-05-06T06:00:33.361Z",
          "progress": 79
        },
        {
          "key": 96,
          "disabled": true,
          "href": "https://ant.design",
          "avatar": "https://gw.alipayobjects.com/zos/rmsportal/eeHMaZBwmTvLdIwMfBpg.png",
          "name": "TradeCode 96",
          "owner": "曲丽丽",
          "desc": "这是一段描述",
          "callNo": 239,
          "status": "1",
          "updatedAt": "2023-05-06T06:00:33.361Z",
          "createdAt": "2023-05-06T06:00:33.361Z",
          "progress": 23
        },
        {
          "key": 95,
          "disabled": false,
          "href": "https://ant.design",
          "avatar": "https://gw.alipayobjects.com/zos/rmsportal/udxAbMEhpwthVVcjLXik.png",
          "name": "TradeCode 95",
          "owner": "曲丽丽",
          "desc": "这是一段描述",
          "callNo": 32,
          "status": "3",
          "updatedAt": "2023-05-06T06:00:33.361Z",
          "createdAt": "2023-05-06T06:00:33.361Z",
          "progress": 56
        },
        {
          "key": 94,
          "disabled": false,
          "href": "https://ant.design",
          "avatar": "https://gw.alipayobjects.com/zos/rmsportal/eeHMaZBwmTvLdIwMfBpg.png",
          "name": "TradeCode 94",
          "owner": "曲丽丽",
          "desc": "这是一段描述",
          "callNo": 25,
          "status": "3",
          "updatedAt": "2023-05-06T06:00:33.361Z",
          "createdAt": "2023-05-06T06:00:33.361Z",
          "progress": 5
        },
        {
          "key": 93,
          "disabled": false,
          "href": "https://ant.design",
          "avatar": "https://gw.alipayobjects.com/zos/rmsportal/udxAbMEhpwthVVcjLXik.png",
          "name": "TradeCode 93",
          "owner": "曲丽丽",
          "desc": "这是一段描述",
          "callNo": 16,
          "status": "3",
          "updatedAt": "2023-05-06T06:00:33.361Z",
          "createdAt": "2023-05-06T06:00:33.361Z",
          "progress": 2
        },
        {
          "key": 92,
          "disabled": false,
          "href": "https://ant.design",
          "avatar": "https://gw.alipayobjects.com/zos/rmsportal/eeHMaZBwmTvLdIwMfBpg.png",
          "name": "TradeCode 92",
          "owner": "曲丽丽",
          "desc": "这是一段描述",
          "callNo": 963,
          "status": "1",
          "updatedAt": "2023-05-06T06:00:33.361Z",
          "createdAt": "2023-05-06T06:00:33.361Z",
          "progress": 28
        },
        {
          "key": 91,
          "disabled": false,
          "href": "https://ant.design",
          "avatar": "https://gw.alipayobjects.com/zos/rmsportal/udxAbMEhpwthVVcjLXik.png",
          "name": "TradeCode 91",
          "owner": "曲丽丽",
          "desc": "这是一段描述",
          "callNo": 788,
          "status": "0",
          "updatedAt": "2023-05-06T06:00:33.361Z",
          "createdAt": "2023-05-06T06:00:33.361Z",
          "progress": 89
        },
        {
          "key": 90,
          "disabled": true,
          "href": "https://ant.design",
          "avatar": "https://gw.alipayobjects.com/zos/rmsportal/eeHMaZBwmTvLdIwMfBpg.png",
          "name": "TradeCode 90",
          "owner": "曲丽丽",
          "desc": "这是一段描述",
          "callNo": 948,
          "status": "1",
          "updatedAt": "2023-05-06T06:00:33.361Z",
          "createdAt": "2023-05-06T06:00:33.361Z",
          "progress": 22
        },
        {
          "key": 89,
          "disabled": false,
          "href": "https://ant.design",
          "avatar": "https://gw.alipayobjects.com/zos/rmsportal/udxAbMEhpwthVVcjLXik.png",
          "name": "TradeCode 89",
          "owner": "曲丽丽",
          "desc": "这是一段描述",
          "callNo": 498,
          "status": "2",
          "updatedAt": "2023-05-06T06:00:33.361Z",
          "createdAt": "2023-05-06T06:00:33.361Z",
          "progress": 89
        },
        {
          "key": 88,
          "disabled": false,
          "href": "https://ant.design",
          "avatar": "https://gw.alipayobjects.com/zos/rmsportal/eeHMaZBwmTvLdIwMfBpg.png",
          "name": "TradeCode 88",
          "owner": "曲丽丽",
          "desc": "这是一段描述",
          "callNo": 269,
          "status": "1",
          "updatedAt": "2023-05-06T06:00:33.361Z",
          "createdAt": "2023-05-06T06:00:33.361Z",
          "progress": 19
        },
        {
          "key": 87,
          "disabled": false,
          "href": "https://ant.design",
          "avatar": "https://gw.alipayobjects.com/zos/rmsportal/udxAbMEhpwthVVcjLXik.png",
          "name": "TradeCode 87",
          "owner": "曲丽丽",
          "desc": "这是一段描述",
          "callNo": 299,
          "status": "0",
          "updatedAt": "2023-05-06T06:00:33.361Z",
          "createdAt": "2023-05-06T06:00:33.361Z",
          "progress": 26
        },
        {
          "key": 86,
          "disabled": false,
          "href": "https://ant.design",
          "avatar": "https://gw.alipayobjects.com/zos/rmsportal/eeHMaZBwmTvLdIwMfBpg.png",
          "name": "TradeCode 86",
          "owner": "曲丽丽",
          "desc": "这是一段描述",
          "callNo": 255,
          "status": "3",
          "updatedAt": "2023-05-06T06:00:33.361Z",
          "createdAt": "2023-05-06T06:00:33.361Z",
          "progress": 16
        },
        {
          "key": 85,
          "disabled": false,
          "href": "https://ant.design",
          "avatar": "https://gw.alipayobjects.com/zos/rmsportal/udxAbMEhpwthVVcjLXik.png",
          "name": "TradeCode 85",
          "owner": "曲丽丽",
          "desc": "这是一段描述",
          "callNo": 32,
          "status": "3",
          "updatedAt": "2023-05-06T06:00:33.361Z",
          "createdAt": "2023-05-06T06:00:33.361Z",
          "progress": 95
        },
        {
          "key": 84,
          "disabled": true,
          "href": "https://ant.design",
          "avatar": "https://gw.alipayobjects.com/zos/rmsportal/eeHMaZBwmTvLdIwMfBpg.png",
          "name": "TradeCode 84",
          "owner": "曲丽丽",
          "desc": "这是一段描述",
          "callNo": 916,
          "status": "3",
          "updatedAt": "2023-05-06T06:00:33.361Z",
          "createdAt": "2023-05-06T06:00:33.361Z",
          "progress": 78
        },
        {
          "key": 83,
          "disabled": false,
          "href": "https://ant.design",
          "avatar": "https://gw.alipayobjects.com/zos/rmsportal/udxAbMEhpwthVVcjLXik.png",
          "name": "TradeCode 83",
          "owner": "曲丽丽",
          "desc": "这是一段描述",
          "callNo": 405,
          "status": "2",
          "updatedAt": "2023-05-06T06:00:33.361Z",
          "createdAt": "2023-05-06T06:00:33.361Z",
          "progress": 91
        },
        {
          "key": 82,
          "disabled": false,
          "href": "https://ant.design",
          "avatar": "https://gw.alipayobjects.com/zos/rmsportal/eeHMaZBwmTvLdIwMfBpg.png",
          "name": "TradeCode 82",
          "owner": "曲丽丽",
          "desc": "这是一段描述",
          "callNo": 95,
          "status": "3",
          "updatedAt": "2023-05-06T06:00:33.361Z",
          "createdAt": "2023-05-06T06:00:33.361Z",
          "progress": 32
        },
        {
          "key": 81,
          "disabled": false,
          "href": "https://ant.design",
          "avatar": "https://gw.alipayobjects.com/zos/rmsportal/udxAbMEhpwthVVcjLXik.png",
          "name": "TradeCode 81",
          "owner": "曲丽丽",
          "desc": "这是一段描述",
          "callNo": 42,
          "status": "0",
          "updatedAt": "2023-05-06T06:00:33.361Z",
          "createdAt": "2023-05-06T06:00:33.361Z",
          "progress": 45
        },
        {
          "key": 80,
          "disabled": false,
          "href": "https://ant.design",
          "avatar": "https://gw.alipayobjects.com/zos/rmsportal/eeHMaZBwmTvLdIwMfBpg.png",
          "name": "TradeCode 80",
          "owner": "曲丽丽",
          "desc": "这是一段描述",
          "callNo": 254,
          "status": "1",
          "updatedAt": "2023-05-06T06:00:33.361Z",
          "createdAt": "2023-05-06T06:00:33.361Z",
          "progress": 81
        }
      ],
      "total": 100,
      "success": true,
      "pageSize": 20,
      "current": 1
    },
    "query": {
      "current": "1",
      "pageSize": "20"
    },
    "payload": {},
    "types": "/** GET /api/rule */\nexport type GET_API_RULE_QUERY = {\n  /** example: 1 */\n        current: string;\n  /** example: 20 */\n        pageSize: string\n}\n  \n\nexport type GET_API_RULE_PAYLOAD = {\n  \n}\n  \n\nexport type GET_API_RULE_RES = {\n  /** example: [{\"key\": 99, \"disabled\": false, \"href\": \"https: //ant.design\", \"avatar\": \"https: //gw.alipayobjects.com/zos/rmsportal/udxAbMEhpwthVVcjLXik.png\", \"name\": \"TradeCode 99\", \"owner\": \"曲丽丽\", \"desc\": \"这是一段描述\", \"callNo\": 118, \"status\": \"3\", \"updatedAt\": \"2023-05-06T06: 00: 33.361Z\", \"createdAt\": \"2023-05-06T06: 00: 33.361Z\", \"progress\": 44}, {\"key\": 98, \"disabled\": false, \"href\": \"https: //ant.design\", \"avatar\": \"https: //gw.alipayobjects.com/zos/rmsportal/eeHMaZBwmTvLdIwMfBpg.png\", \"name\": \"TradeCode 98\", \"owner\": \"曲丽丽\", \"desc\": \"这是一段描述\", \"callNo\": 267, \"status\": \"0\", \"updatedAt\": \"2023-05-06T06: 00: 33.361Z\", \"createdAt\": \"2023-05-06T06: 00: 33.361Z\", \"progress\": 46}, {\"key\": 97, \"disabled\": false, \"href\": \"https: //ant.design\", \"avatar\": \"https: //gw.alipayobjects.com/zos/rmsportal/udxAbMEhpwthVVcjLXik.png\", \"name\": \"TradeCode 97\", \"owner\": \"曲丽丽\", \"desc\": \"这是一段描述\", \"callNo\": 642, \"status\": \"3\", \"updatedAt\": \"2023-05-06T06: 00: 33.361Z\", \"createdAt\": \"2023-05-06T06: 00: 33.361Z\", \"progress\": 79}, {\"key\": 96, \"disabled\": true, \"href\": \"https: //ant.design\", \"avatar\": \"https: //gw.alipayobjects.com/zos/rmsportal/eeHMaZBwmTvLdIwMfBpg.png\", \"name\": \"TradeCode 96\", \"owner\": \"曲丽丽\", \"desc\": \"这是一段描述\", \"callNo\": 239, \"status\": \"1\", \"updatedAt\": \"2023-05-06T06: 00: 33.361Z\", \"createdAt\": \"2023-05-06T06: 00: 33.361Z\", \"progress\": 23}, {\"key\": 95, \"disabled\": false, \"href\": \"https: //ant.design\", \"avatar\": \"https: //gw.alipayobjects.com/zos/rmsportal/udxAbMEhpwthVVcjLXik.png\", \"name\": \"TradeCode 95\", \"owner\": \"曲丽丽\", \"desc\": \"这是一段描述\", \"callNo\": 32, \"status\": \"3\", \"updatedAt\": \"2023-05-06T06: 00: 33.361Z\", \"createdAt\": \"2023-05-06T06: 00: 33.361Z\", \"progress\": 56}, {\"key\": 94, \"disabled\": false, \"href\": \"https: //ant.design\", \"avatar\": \"https: //gw.alipayobjects.com/zos/rmsportal/eeHMaZBwmTvLdIwMfBpg.png\", \"name\": \"TradeCode 94\", \"owner\": \"曲丽丽\", \"desc\": \"这是一段描述\", \"callNo\": 25, \"status\": \"3\", \"updatedAt\": \"2023-05-06T06: 00: 33.361Z\", \"createdAt\": \"2023-05-06T06: 00: 33.361Z\", \"progress\": 5}, {\"key\": 93, \"disabled\": false, \"href\": \"https: //ant.design\", \"avatar\": \"https: //gw.alipayobjects.com/zos/rmsportal/udxAbMEhpwthVVcjLXik.png\", \"name\": \"TradeCode 93\", \"owner\": \"曲丽丽\", \"desc\": \"这是一段描述\", \"callNo\": 16, \"status\": \"3\", \"updatedAt\": \"2023-05-06T06: 00: 33.361Z\", \"createdAt\": \"2023-05-06T06: 00: 33.361Z\", \"progress\": 2}, {\"key\": 92, \"disabled\": false, \"href\": \"https: //ant.design\", \"avatar\": \"https: //gw.alipayobjects.com/zos/rmsportal/eeHMaZBwmTvLdIwMfBpg.png\", \"name\": \"TradeCode 92\", \"owner\": \"曲丽丽\", \"desc\": \"这是一段描述\", \"callNo\": 963, \"status\": \"1\", \"updatedAt\": \"2023-05-06T06: 00: 33.361Z\", \"createdAt\": \"2023-05-06T06: 00: 33.361Z\", \"progress\": 28}, {\"key\": 91, \"disabled\": false, \"href\": \"https: //ant.design\", \"avatar\": \"https: //gw.alipayobjects.com/zos/rmsportal/udxAbMEhpwthVVcjLXik.png\", \"name\": \"TradeCode 91\", \"owner\": \"曲丽丽\", \"desc\": \"这是一段描述\", \"callNo\": 788, \"status\": \"0\", \"updatedAt\": \"2023-05-06T06: 00: 33.361Z\", \"createdAt\": \"2023-05-06T06: 00: 33.361Z\", \"progress\": 89}, {\"key\": 90, \"disabled\": true, \"href\": \"https: //ant.design\", \"avatar\": \"https: //gw.alipayobjects.com/zos/rmsportal/eeHMaZBwmTvLdIwMfBpg.png\", \"name\": \"TradeCode 90\", \"owner\": \"曲丽丽\", \"desc\": \"这是一段描述\", \"callNo\": 948, \"status\": \"1\", \"updatedAt\": \"2023-05-06T06: 00: 33.361Z\", \"createdAt\": \"2023-05-06T06: 00: 33.361Z\", \"progress\": 22}, {\"key\": 89, \"disabled\": false, \"href\": \"https: //ant.design\", \"avatar\": \"https: //gw.alipayobjects.com/zos/rmsportal/udxAbMEhpwthVVcjLXik.png\", \"name\": \"TradeCode 89\", \"owner\": \"曲丽丽\", \"desc\": \"这是一段描述\", \"callNo\": 498, \"status\": \"2\", \"updatedAt\": \"2023-05-06T06: 00: 33.361Z\", \"createdAt\": \"2023-05-06T06: 00: 33.361Z\", \"progress\": 89}, {\"key\": 88, \"disabled\": false, \"href\": \"https: //ant.design\", \"avatar\": \"https: //gw.alipayobjects.com/zos/rmsportal/eeHMaZBwmTvLdIwMfBpg.png\", \"name\": \"TradeCode 88\", \"owner\": \"曲丽丽\", \"desc\": \"这是一段描述\", \"callNo\": 269, \"status\": \"1\", \"updatedAt\": \"2023-05-06T06: 00: 33.361Z\", \"createdAt\": \"2023-05-06T06: 00: 33.361Z\", \"progress\": 19}, {\"key\": 87, \"disabled\": false, \"href\": \"https: //ant.design\", \"avatar\": \"https: //gw.alipayobjects.com/zos/rmsportal/udxAbMEhpwthVVcjLXik.png\", \"name\": \"TradeCode 87\", \"owner\": \"曲丽丽\", \"desc\": \"这是一段描述\", \"callNo\": 299, \"status\": \"0\", \"updatedAt\": \"2023-05-06T06: 00: 33.361Z\", \"createdAt\": \"2023-05-06T06: 00: 33.361Z\", \"progress\": 26}, {\"key\": 86, \"disabled\": false, \"href\": \"https: //ant.design\", \"avatar\": \"https: //gw.alipayobjects.com/zos/rmsportal/eeHMaZBwmTvLdIwMfBpg.png\", \"name\": \"TradeCode 86\", \"owner\": \"曲丽丽\", \"desc\": \"这是一段描述\", \"callNo\": 255, \"status\": \"3\", \"updatedAt\": \"2023-05-06T06: 00: 33.361Z\", \"createdAt\": \"2023-05-06T06: 00: 33.361Z\", \"progress\": 16}, {\"key\": 85, \"disabled\": false, \"href\": \"https: //ant.design\", \"avatar\": \"https: //gw.alipayobjects.com/zos/rmsportal/udxAbMEhpwthVVcjLXik.png\", \"name\": \"TradeCode 85\", \"owner\": \"曲丽丽\", \"desc\": \"这是一段描述\", \"callNo\": 32, \"status\": \"3\", \"updatedAt\": \"2023-05-06T06: 00: 33.361Z\", \"createdAt\": \"2023-05-06T06: 00: 33.361Z\", \"progress\": 95}, {\"key\": 84, \"disabled\": true, \"href\": \"https: //ant.design\", \"avatar\": \"https: //gw.alipayobjects.com/zos/rmsportal/eeHMaZBwmTvLdIwMfBpg.png\", \"name\": \"TradeCode 84\", \"owner\": \"曲丽丽\", \"desc\": \"这是一段描述\", \"callNo\": 916, \"status\": \"3\", \"updatedAt\": \"2023-05-06T06: 00: 33.361Z\", \"createdAt\": \"2023-05-06T06: 00: 33.361Z\", \"progress\": 78}, {\"key\": 83, \"disabled\": false, \"href\": \"https: //ant.design\", \"avatar\": \"https: //gw.alipayobjects.com/zos/rmsportal/udxAbMEhpwthVVcjLXik.png\", \"name\": \"TradeCode 83\", \"owner\": \"曲丽丽\", \"desc\": \"这是一段描述\", \"callNo\": 405, \"status\": \"2\", \"updatedAt\": \"2023-05-06T06: 00: 33.361Z\", \"createdAt\": \"2023-05-06T06: 00: 33.361Z\", \"progress\": 91}, {\"key\": 82, \"disabled\": false, \"href\": \"https: //ant.design\", \"avatar\": \"https: //gw.alipayobjects.com/zos/rmsportal/eeHMaZBwmTvLdIwMfBpg.png\", \"name\": \"TradeCode 82\", \"owner\": \"曲丽丽\", \"desc\": \"这是一段描述\", \"callNo\": 95, \"status\": \"3\", \"updatedAt\": \"2023-05-06T06: 00: 33.361Z\", \"createdAt\": \"2023-05-06T06: 00: 33.361Z\", \"progress\": 32}, {\"key\": 81, \"disabled\": false, \"href\": \"https: //ant.design\", \"avatar\": \"https: //gw.alipayobjects.com/zos/rmsportal/udxAbMEhpwthVVcjLXik.png\", \"name\": \"TradeCode 81\", \"owner\": \"曲丽丽\", \"desc\": \"这是一段描述\", \"callNo\": 42, \"status\": \"0\", \"updatedAt\": \"2023-05-06T06: 00: 33.361Z\", \"createdAt\": \"2023-05-06T06: 00: 33.361Z\", \"progress\": 45}, {\"key\": 80, \"disabled\": false, \"href\": \"https: //ant.design\", \"avatar\": \"https: //gw.alipayobjects.com/zos/rmsportal/eeHMaZBwmTvLdIwMfBpg.png\", \"name\": \"TradeCode 80\", \"owner\": \"曲丽丽\", \"desc\": \"这是一段描述\", \"callNo\": 254, \"status\": \"1\", \"updatedAt\": \"2023-05-06T06: 00: 33.361Z\", \"createdAt\": \"2023-05-06T06: 00: 33.361Z\", \"progress\": 81}] */\n        data: {\n      key: number,\ndisabled: boolean,\nhref: string,\navatar: string,\nname: string,\nowner: string,\ndesc: string,\ncallNo: number,\nstatus: string,\nupdatedAt: string,\ncreatedAt: string,\nprogress: number\n      }[];\n  /** example: 100 */\n        total: number;\n  /** example: true */\n        success: boolean;\n  /** example: 20 */\n        pageSize: number;\n  /** example: 1 */\n        current: number\n}\n  "
  },
  "POST /api/login/outLogin": {
    "res": {
      "data": {},
      "success": true
    },
    "query": {
      "token ": " 123"
    },
    "payload": {},
    "types": "/** POST /api/login/outLogin */\nexport type POST_API_LOGIN_OUT_LOGIN_QUERY = {\n  /** example:  123 */\n        token : string\n}\n  \n\nexport type POST_API_LOGIN_OUT_LOGIN_PAYLOAD = {\n  \n}\n  \n\nexport type POST_API_LOGIN_OUT_LOGIN_RES = {\n  /** example: {} */\n        data: {\n      \n      };\n  /** example: true */\n        success: boolean\n}\n  "
  },
  "POST /api/login/account": {
    "res": {
      "status": "error",
      "type": "account",
      "currentAuthority": "guest"
    },
    "query": {},
    "payload": {
      "username": "123",
      "password": "123",
      "autoLogin": true,
      "type": "account"
    },
    "types": "/** POST /api/login/account */\nexport type POST_API_LOGIN_ACCOUNT_QUERY = {\n  \n}\n  \n\nexport type POST_API_LOGIN_ACCOUNT_PAYLOAD = {\n  /** example: 123 */\n        username: string;\n  /** example: 123 */\n        password: string;\n  /** example: true */\n        autoLogin: boolean;\n  /** example: account */\n        type: string\n}\n  \n\nexport type POST_API_LOGIN_ACCOUNT_RES = {\n  /** example: error */\n        status: string;\n  /** example: account */\n        type: string;\n  /** example: guest */\n        currentAuthority: string\n}\n  "
  }
}